{
  "$schema": "https://json-schema.org/draft/2020-12/schema",
  "$id": "tarlaanaliz/schemas/core/mission.v1.schema.json",
  "title": "Mission",
  "description": "Uçuş görevi (Mission) veri sözleşmesi — KR-028 kanonik. SSOT Uyum: 1.2.0 (2026-02-24).\nDEĞİŞİKLİK NOTU: drone_model alanı DroneType enum'una bağlandı (drone-agnostik mimari, KR-015). mission_source alanı eklendi (tek seferlik vs Sezonluk Paket).",
  "type": "object",
  "unevaluatedProperties": false,
  "required": [
    "mission_id",
    "field_id",
    "crop_type",
    "status",
    "mission_source",
    "planned_date",
    "due_date",
    "created_at"
  ],
  "properties": {
    "mission_id": {
      "type": "string",
      "format": "uuid",
      "description": "Sistemin ürettiği benzersiz görev kimliği (UUID v4). Dosya adında: {MissionID}_{ParcelRef}_{YYYYMMDD}.kmz"
    },
    "field_id": {
      "type": "string",
      "format": "uuid",
      "description": "Hangi tarla için görev oluşturulduğu. field.v1.schema.json referansı."
    },
    "subscription_id": {
      "type": ["string", "null"],
      "format": "uuid",
      "description": "Sezonluk Paket'ten üretildiyse subscription_id. mission_source=SUBSCRIPTION ise zorunlu."
    },
    "pilot_id": {
      "type": ["string", "null"],
      "description": "Göreve atanan pilotun user_id değeri. Başlangıçta null (atanmadı). Pilot PII görmez; sadece MissionID + ParcelRef görür."
    },
    "crop_type": {
      "$ref": "../../enums/crop_type.enum.v1.json",
      "description": "Bitki türü kodu. YZ model routing için kullanılır."
    },
    "status": {
      "$ref": "../../enums/mission_status.enum.v1.json",
      "description": "Görev durumu. Her durum geçişi audit log'a yazılır."
    },
    "mission_source": {
      "type": "string",
      "enum": ["SINGLE", "SUBSCRIPTION"],
      "description": "Mission kaynağı. SINGLE = tek seferlik analiz talebi; SUBSCRIPTION = Sezonluk Paket scheduler'ı tarafından üretildi. KR-028."
    },
    "payment_intent_id": {
      "type": ["string", "null"],
      "description": "İlişkili PaymentIntent ID. PAID olmadan Mission ASSIGNED olamaz (KR-033 Kural-1)."
    },
    "drone_model": {
      "$ref": "../../enums/drone_type.enum.v1.json",
      "description": "Atanan drone modeli (drone-agnostik). Opsiyonel — pilot atama sırasında setlenir. KR-015 + KR-030."
    },
    "planned_date": {
      "type": "string",
      "format": "date",
      "description": "Planlanan uçuş tarihi. Pilot'un görev kutusunda görünür."
    },
    "due_date": {
      "type": "string",
      "format": "date",
      "description": "Son teslim tarihi. SLA hesaplaması için."
    },
    "flown_at": {
      "type": ["string", "null"],
      "format": "date-time",
      "description": "Uçuşun tamamlandığı zaman. SLA alanı."
    },
    "uploaded_at": {
      "type": ["string", "null"],
      "format": "date-time",
      "description": "Verinin istasyona yüklendiği zaman. SLA alanı."
    },
    "analyzed_at": {
      "type": ["string", "null"],
      "format": "date-time",
      "description": "YZ analizinin tamamlandığı zaman. SLA alanı."
    },
    "flight_parameters": {
      "type": ["object", "null"],
      "unevaluatedProperties": false,
      "properties": {
        "altitude_m": { "type": "number", "description": "Uçuş yüksekliği (metre)." },
        "overlap_pct": { "type": "number", "minimum": 0, "maximum": 100, "description": "Görüntü örtüşme oranı (%)." },
        "speed_ms": { "type": "number", "description": "Uçuş hızı (m/s)." },
        "camera_angle_deg": { "type": "number", "description": "Kamera açısı (derece)." }
      }
    },
    "route_file_type": {
      "type": ["string", "null"],
      "enum": ["KML", "KMZ", "WPML", null],
      "description": "Görev dosyası formatı. MVP: KML/KMZ. V2+: WPML (DJI gelişmiş format)."
    },
    "route_file_hash": {
      "type": ["string", "null"],
      "pattern": "^[a-f0-9]{64}$",
      "description": "Görev dosyası SHA-256 hash'i. Kiosk doğrulamasında kullanılır."
    },
    "created_at": {
      "type": "string",
      "format": "date-time"
    },
    "updated_at": {
      "type": ["string", "null"],
      "format": "date-time"
    }
  },
  "$defs": {},
  "x-state-machine": {
    "transitions": [
      "PLANNED → ASSIGNED (pilot atandı; PAID gate zorunlu)",
      "ASSIGNED → IN_PROGRESS (uçuş başladı)",
      "IN_PROGRESS → COMPLETED (veri yüklendi)",
      "COMPLETED → VERIFIED (QC geçti)"
    ],
    "gates": {
      "ASSIGNED": "PaymentIntent.status == PAID olmadan ASSIGNED yapılamaz (KR-033 Kural-1)"
    }
  },
  "x-kr-ref": ["KR-028", "KR-015", "KR-033"],
  "x-ssot-version": "1.2.0",
  "x-updated": "2026-02-24"
}
