{
  "mission_id": "a1b2c3d4-e5f6-7890-abcd-ef1234567890",
  "field_id": "b2c3d4e5-f6a7-8901-bcde-f12345678901",
  "subscription_id": null,
  "pilot_id": null,
  "crop_type": "COTTON",
  "status": "PLANNED",
  "mission_source": "SINGLE",
  "payment_intent_id": null,
  "drone_model": "DJI_MAVIC_3M",
  "planned_date": "2026-06-15",
  "due_date": "2026-06-20",
  "flown_at": null,
  "uploaded_at": null,
  "analyzed_at": null,
  "flight_parameters": {
    "altitude_m": 50,
    "overlap_pct": 75,
    "speed_ms": 5,
    "camera_angle_deg": -90
  },
  "route_file_type": "KMZ",
  "route_file_hash": "a3f2b8c9d4e5f6a7b8c9d0e1f2a3b4c5d6e7f8a9b0c1d2e3f4a5b6c7d8e9f0a1",
  "created_at": "2026-06-01T10:30:00Z",
  "updated_at": null
}
